{"$defs":{"recursive_semantic_value":{"anyOf":[{"type":"null"},{"type":"boolean"},{"type":"number"},{"type":"string"},{"items":{"$ref":"#/$defs/recursive_semantic_value"},"type":"array"},{"additionalProperties":{"$ref":"#/$defs/recursive_semantic_value"},"properties":{"evidence_locator":{"$ref":"#/$defs/safe_evidence_locator"},"safe_locator":{"$ref":"#/$defs/safe_evidence_locator"}},"propertyNames":{"not":{"anyOf":[{"enum":["canonical_ref","project_ref","scene_ref","shot_ref","artifact_ref","ref","digest","timestamp","idempotency","expected_version","accepted","rejected","frozen","delivered","budget","budget_receipt","provider","provider_payload","model","credential","credentials","raw_prompt","hidden_prompt","tool_call"]},{"pattern":"(^|[_ .-])[Rr][Ee][Ff]$"}]}},"type":"object"}]},"safe_evidence_locator":{"allOf":[{"pattern":"^evidence://[^\\r\\n]*$"},{"not":{"pattern":"[Ss][Hh][Aa]256:|[Pp][Rr][Oo][Mm][Pp][Tt][Rr][Ee][Pp][Oo]://"}}],"maxLength":2048,"type":"string"}},"$id":"https://schemas.yeisme.dev/promptrepo/ai-film-multi-profile-production/project-intent-semantic-output-v1","$schema":"https://json-schema.org/draft/2020-12/schema","additionalProperties":false,"allOf":[{"$ref":"#/$defs/recursive_semantic_value"}],"properties":{"asset_dramatic_functions":{"items":{"additionalProperties":true,"maxProperties":32,"type":"object"},"maxItems":64,"type":"array"},"bounded_next_actions":{"items":{"maxLength":2048,"minLength":1,"type":"string"},"maxItems":16,"type":"array"},"eight_part_obligations":{"items":{"additionalProperties":true,"maxProperties":32,"type":"object"},"maxItems":64,"type":"array"},"emotional_protagonist":{"items":{"additionalProperties":true,"maxProperties":32,"type":"object"},"maxItems":64,"type":"array"},"findings":{"items":{"additionalProperties":false,"properties":{"code":{"maxLength":128,"minLength":2,"type":"string"},"evidence":{"maxLength":2048,"minLength":1,"type":"string"},"repair":{"maxLength":2048,"minLength":1,"type":"string"},"severity":{"enum":["blocking","high","medium","low","unknown"]}},"required":["code","severity","evidence","repair"],"type":"object"},"maxItems":32,"type":"array"},"profile_id":{"enum":["cinematic_live_action","motion_comic","stylized_animation","brand_film"]},"profile_risks":{"items":{"additionalProperties":true,"maxProperties":32,"type":"object"},"maxItems":64,"type":"array"},"protagonist_arc":{"items":{"additionalProperties":true,"maxProperties":32,"type":"object"},"maxItems":64,"type":"array"},"relationship_pressure":{"items":{"additionalProperties":true,"maxProperties":32,"type":"object"},"maxItems":64,"type":"array"},"scene_obligations":{"items":{"additionalProperties":true,"maxProperties":32,"type":"object"},"maxItems":64,"type":"array"},"theme_statement":{"maxLength":4096,"minLength":1,"type":"string"},"uncertainty":{"additionalProperties":{"maxLength":2048,"type":"string"},"maxProperties":16,"type":"object"}},"propertyNames":{"not":{"enum":["canonical_ref","project_ref","scene_ref","shot_ref","artifact_ref","digest","timestamp","idempotency","expected_version","accepted","rejected","frozen","delivered","budget","budget_receipt","provider","provider_payload","model","credential","raw_prompt","hidden_prompt","tool_call"]}},"required":["profile_id","theme_statement","emotional_protagonist","protagonist_arc","relationship_pressure","asset_dramatic_functions","eight_part_obligations","scene_obligations","profile_risks","findings","bounded_next_actions","uncertainty"],"type":"object"}