{"asset_dramatic_functions":[{"asset_id":"fixture-relic","function":"forces a costly choice"}],"bounded_next_actions":["owner validates source projection"],"eight_part_obligations":[{"part":1,"turn":"goal changes"}],"emotional_protagonist":[{"character_id":"fixture-hero","need":"trust"}],"findings":[],"profile_id":"cinematic_live_action","profile_risks":[{"risk":"identity drift"}],"protagonist_arc":[{"from":"control","to":"shared responsibility"}],"relationship_pressure":[{"belief":"power solves safety","challenger":"fixture-peer"}],"scene_obligations":[{"scene_id":"fixture-scene","state_change":"trust breaks"}],"theme_statement":"Protection is a choice under pressure","uncertainty":{"evidence":"fixture-only"}}